{
  "metadata": {
    "version": "1.0",
    "language": "it",
    "surveyId": "telmob_it"
  },
  "sections": [
    {
      "id": "executive",
      "index": 0,
      "name": "Rapporto esecutivo",
      "icon": "FileText",
      "subsections": [
        {
          "id": "executive-summary",
          "index": 0,
          "name": "Sintesi",
          "icon": "ClipboardList",
          "components": [
            {
              "type": "card",
              "index": 0,
              "title": "Approfondimenti chiave",
              "text": "L'insoddisfazione dei clienti nella telefonia mobile è causata principalmente da guasti nei servizi di rete, che comportano un alto rischio di abbandono e un urgente bisogno di miglioramenti mirati all'infrastruttura e al supporto.\n[*] Il net promoter score è -21, con i detrattori che superano i promotori di 21 punti, segnalando un'insoddisfazione diffusa.  \n[*] I problemi di servizio di rete dominano il feedback negativo, interessando il 43% degli intervistati e causando il maggiore impatto sulla soddisfazione complessiva.  \n[*] Il supporto clienti e la copertura di rete mostrano risultati contrastanti ma rimangono aree chiave che influenzano la fedeltà e il rischio di abbandono.  \n[*] I clienti postpagati riportano una soddisfazione significativamente inferiore a causa della fatturazione e della qualità del servizio, mentre le regioni Veneto e Toscana mostrano la fedeltà più bassa.",
              "cardStyleVariant": "default"
            },
            {
              "type": "card",
              "index": 1,
              "title": "Principali implicazioni",
              "text": "[*] L'elevato volume di detrattori e l'intenzione di abbandono (36%) minacciano la stabilità dei ricavi e la quota di mercato.  \n[*] L'affidabilità della rete e la trasparenza della fatturazione sono aree prioritarie per ridurre l'attrito dei clienti, specialmente nei segmenti postpagati e nelle aree regionali critiche.  \n[*] Rafforzare il supporto clienti nelle regioni critiche può migliorare la fidelizzazione e la promozione del marchio.",
              "cardStyleVariant": "default"
            },
            {
              "type": "grid-container",
              "index": 2,
              "components": [
                {
                  "type": "card",
                  "index": 0,
                  "title": "Punti chiave",
                  "text": "[*] Il supporto clienti mostra una forza relativa con un impatto positivo moderato in Toscana e Lazio.",
                  "cardStyleVariant": "default"
                },
                {
                  "type": "card",
                  "index": 1,
                  "title": "Opportunità di miglioramento",
                  "text": "[*] Il servizio di rete è il principale fattore negativo, con un impatto severo sulla soddisfazione e sulla fedeltà.  \n[*] La copertura di rete e l'offerta/prezzi contribuiscono anch'essi negativamente, richiedendo attenzione.",
                  "cardStyleVariant": "default"
                }
              ]
            },
            {
              "type": "card",
              "index": 3,
              "title": "Linee guida strategiche",
              "text": "[*] Dare priorità agli aggiornamenti dell'infrastruttura di rete e all'ottimizzazione della copertura nelle aree chiave con deficit.\n[*] Affrontare le problematiche di trasparenza nella fatturazione e qualità del servizio per i clienti postpagati.\n[*] Migliorare le capacità di supporto clienti e la comunicazione mirata nelle regioni con scarse prestazioni.",
              "cardStyleVariant": "default"
            }
          ]
        },
        {
          "id": "executive-recommendations",
          "index": 1,
          "name": "Raccomandazioni",
          "icon": "AlertTriangle",
          "components": [
            {
              "type": "card",
              "index": 0,
              "title": "",
              "text": "",
              "cardStyleVariant": "overflow-hidden",
              "components": [
                {
                  "type": "recommendationsTable",
                  "index": 0,
                  "dataPath": "sectionData.recommendationsTable"
                }
              ]
            }
          ]
        }
      ],
      "data": {
        "recommendationsTable": {
          "config": {
            "severityLabels": {
              "high": "Alto",
              "medium": "Médio",
              "low": "Baixo",
              "critical": "Crítico"
            }
          },
          "items": [
            {
              "id": 1,
              "recommendation": "Espandere e Ottimizzare la Copertura di Rete nelle Aree Chiave in Deficit",
              "severity": "high",
              "stakeholders": [
                "Operazioni di Rete",
                "Rete di Accesso Radio (RAN)",
                "Ottimizzazione della Rete"
              ],
              "tasks": [
                {
                  "task": "Condurre un'analisi dettagliata della copertura per identificare le aree chiave di deficit",
                  "owner": "Ottimizzazione della rete"
                },
                {
                  "task": "Sviluppare un piano di espansione che includa infrastrutture e risorse necessarie",
                  "owner": "Operazioni di rete"
                },
                {
                  "task": "Coordinarsi con la Radio Access Network (RAN) per progettare configurazioni radio ottimali",
                  "owner": "Rete di accesso radio (RAN)"
                },
                {
                  "task": "Procura l'attrezzatura e i materiali necessari per l'espansione della rete",
                  "owner": "Operazioni di rete"
                },
                {
                  "task": "Installa e integra la nuova infrastruttura di rete nelle aree identificate",
                  "owner": "Operazioni di rete"
                },
                {
                  "task": "Eseguire la sintonizzazione e l'ottimizzazione della frequenza radio dopo l'installazione",
                  "owner": "Rete di accesso radio (RAN)"
                },
                {
                  "task": "Eseguire test di rete approfonditi e assicurazione della qualità nelle aree ampliate",
                  "owner": "Ottimizzazione della rete"
                },
                {
                  "task": "Monitorare le metriche di prestazione e regolare le configurazioni per l'ottimizzazione",
                  "owner": "Ottimizzazione della rete"
                },
                {
                  "task": "Segnalare regolarmente i progressi e le problematiche a tutti gli stakeholder",
                  "owner": "Operazioni di rete"
                }
              ]
            },
            {
              "id": 2,
              "recommendation": "Migliora l'affidabilità della rete attraverso aggiornamenti infrastrutturali",
              "severity": "high",
              "stakeholders": [
                "Rete Core",
                "Rete di Trasporto",
                "Ingegneria di Rete"
              ],
              "tasks": [
                {
                  "task": "Condurre una valutazione completa dell'infrastruttura di rete per identificare le debolezze",
                  "owner": "Ingegneria di rete"
                },
                {
                  "task": "Sviluppare un piano di aggiornamento dettagliato basato sui risultati della valutazione",
                  "owner": "Ingegneria di rete"
                },
                {
                  "task": "Acquistare hardware e software necessari per gli aggiornamenti dell'infrastruttura",
                  "owner": "Rete centrale"
                },
                {
                  "task": "Pianificare l'implementazione dell'aggiornamento minimizzando l'interruzione del servizio",
                  "owner": "Rete di trasporto"
                },
                {
                  "task": "Coordinarsi con i fornitori per la consegna puntuale delle attrezzature",
                  "owner": "Rete centrale"
                },
                {
                  "task": "Distribuire hardware e software aggiornati attraverso i nodi della rete",
                  "owner": "Ingegneria di rete"
                },
                {
                  "task": "Eseguire test rigorosi dell'infrastruttura aggiornata per la sua affidabilità",
                  "owner": "Ingegneria di rete"
                },
                {
                  "task": "Monitorare le prestazioni della rete dopo l'aggiornamento per garantire miglioramenti",
                  "owner": "Rete centrale"
                },
                {
                  "task": "Fornire formazione al personale operativo sulle nuove funzionalità dell'infrastruttura",
                  "owner": "Ingegneria di rete"
                },
                {
                  "task": "Documentare tutte le modifiche e aggiornare i manuali di funzionamento della rete",
                  "owner": "Ingegneria di rete"
                },
                {
                  "task": "Stabilire un programma di manutenzione continua per l'infrastruttura aggiornata",
                  "owner": "Rete di trasporto"
                }
              ]
            },
            {
              "id": 3,
              "recommendation": "Migliora la qualità del segnale tramite tecnologie radio avanzate",
              "severity": "medium",
              "stakeholders": [
                "Rete di Accesso Radio (RAN)",
                "Ingegneria di Rete",
                "Tecnologia e IT"
              ],
              "tasks": [
                {
                  "task": "Eseguire la valutazione della qualità del segnale corrente e la misurazione di base",
                  "owner": "Rete di accesso radio (RAN)"
                },
                {